{
  "$schema": "../../../manifests/core-source-lock.schema.json",
  "schema_version": 1,
  "source_lock_id": "2048-c90437d3c391",
  "core_id": "2048",
  "source": {
    "url": "https://github.com/libretro/libretro-2048.git",
    "requested_ref": "refs/heads/master",
    "commit": "c90437d3c3913999624deca3fb55ecfa632b72c4",
    "tree": "5b8bcab69dc90185f10356b5780bf9d827684474",
    "submodules": []
  },
  "local_only": true,
  "publication": "disabled",
  "content_sha256": "c89f2f646f2c3c1414a2a8969488e29d6ff2d6002be3e73c41c789851ee2f55a"
}
