{
  "$schema": "../../../manifests/core-source-lock.schema.json",
  "schema_version": 1,
  "source_lock_id": "neocd-9e9ad181bed6",
  "core_id": "neocd",
  "source": {
    "url": "https://github.com/libretro/neocd_libretro.git",
    "requested_ref": "refs/heads/master",
    "commit": "9e9ad181bed60f84f9cff02c03617b41e8a31cfe",
    "tree": "c82440c78b368bbd4c58122d796e4d9beb40c22a",
    "submodules": []
  },
  "local_only": true,
  "publication": "disabled",
  "content_sha256": "de14e5aab2a921062683dcb5ddc9292d35a089916b485c046dfc984bd45226a0"
}
