{
  "$schema": "../../../manifests/core-source-lock.schema.json",
  "schema_version": 1,
  "source_lock_id": "quicknes-26bb785c9ded",
  "core_id": "quicknes",
  "source": {
    "url": "https://github.com/libretro/QuickNES_Core.git",
    "requested_ref": "refs/heads/master",
    "commit": "26bb785c9deddb66a17717b21bb4e328f03ade32",
    "tree": "52de71e4e1acc5a4a039b07f7ed67d425df97a89",
    "submodules": []
  },
  "local_only": true,
  "publication": "disabled",
  "content_sha256": "4e8be2d851d477f0bafa84ac6570776defbbed59d62be570a75d3760956e6ca3"
}
