{
  "$schema": "../../../manifests/core-source-lock.schema.json",
  "schema_version": 1,
  "source_lock_id": "mednafen_pcfx-650c30ea2203",
  "core_id": "mednafen_pcfx",
  "source": {
    "url": "https://github.com/libretro/beetle-pcfx-libretro.git",
    "requested_ref": "refs/heads/master",
    "commit": "650c30ea2203636a1716675854d11c608ed6eacc",
    "tree": "de7ad272c9210e5dd7772a53a1480dbab47d49cc",
    "submodules": []
  },
  "local_only": true,
  "publication": "disabled",
  "content_sha256": "23cdd98165e6d547fb9488006ec11bf7da12e746d1fddbf9a6a8d356a59bc861"
}
