{
  "$schema": "../../../manifests/core-source-lock.schema.json",
  "schema_version": 1,
  "source_lock_id": "lutro-1df938b3bf37",
  "core_id": "lutro",
  "source": {
    "url": "https://github.com/libretro/libretro-lutro.git",
    "requested_ref": "refs/heads/master",
    "commit": "1df938b3bf37b8d1eb6cdd07ec915c4f569a7551",
    "tree": "d20aac44229476877084e26c2558c63737a86c98",
    "submodules": []
  },
  "local_only": true,
  "publication": "disabled",
  "content_sha256": "cc306158e2d9079ec43d1d2501a118ed6ca68f34b33d62cde2ea6179b7304aeb"
}
