{
  "$schema": "../../../manifests/core-source-lock.schema.json",
  "schema_version": 1,
  "source_lock_id": "np2kai-54ec39f50d19",
  "core_id": "np2kai",
  "source": {
    "url": "https://github.com/libretro/NP2kai.git",
    "requested_ref": "refs/heads/master",
    "commit": "54ec39f50d197cc02909cd4fd2a8591bb38651b0",
    "tree": "dfb9119f775cdba8a5b0eed464ddfe04dffd7c1a",
    "submodules": []
  },
  "local_only": true,
  "publication": "disabled",
  "content_sha256": "17238948a580c0fae37e897f789907d1cc9a814b9e369b729ba019d550caa39d"
}
