{
  "$schema": "../../../manifests/core-source-lock.schema.json",
  "schema_version": 1,
  "source_lock_id": "x1-3e7960a433c3",
  "core_id": "x1",
  "source": {
    "url": "https://github.com/libretro/xmil-libretro.git",
    "requested_ref": "refs/heads/master",
    "commit": "3e7960a433c3bca820f8b8f5511a2b92bd666829",
    "tree": "dc2993fae86d48789557a4f10295243ea40f3d75",
    "submodules": []
  },
  "local_only": true,
  "publication": "disabled",
  "content_sha256": "12eddfa12cd053b81fed77d2112f41df19599e6ad6cf65f157f3ceaf36c2b695"
}
