{
  "$schema": "../../../manifests/core-source-lock.schema.json",
  "schema_version": 1,
  "source_lock_id": "gearsystem-4f029e43f2d5",
  "core_id": "gearsystem",
  "source": {
    "url": "https://github.com/drhelius/Gearsystem.git",
    "requested_ref": "refs/heads/master",
    "commit": "4f029e43f2d5207c5da78792503b0fff89b7b2c5",
    "tree": "8adfb454298c169327d705bebf94e699e5dbf480",
    "submodules": []
  },
  "local_only": true,
  "publication": "disabled",
  "content_sha256": "c51f145625a63362c4d0f2f13c7d4c17a1332b5ffbfbeeb6e0b483bbf8bd40e1"
}
