{
  "$schema": "../../../manifests/core-source-lock.schema.json",
  "schema_version": 1,
  "source_lock_id": "parallel_n64-00c6c9df91d2",
  "core_id": "parallel_n64",
  "source": {
    "url": "https://github.com/libretro/parallel-n64.git",
    "requested_ref": "refs/heads/master",
    "commit": "00c6c9df91d2c2daaae615cefad7911be556fbfa",
    "tree": "d762ea5fe18afe5f245080082148005f1c7ce811",
    "submodules": []
  },
  "local_only": true,
  "publication": "disabled",
  "content_sha256": "d708a3ac0bc83af1f0a7ace0fb990f0324768b92d72d72b4cacaa4d33691c77f"
}
