{
  "$schema": "../../../manifests/core-source-lock.schema.json",
  "schema_version": 1,
  "source_lock_id": "mednafen_lynx-fcdefcfb3c11",
  "core_id": "mednafen_lynx",
  "source": {
    "url": "https://github.com/libretro/beetle-lynx-libretro.git",
    "requested_ref": "refs/heads/master",
    "commit": "fcdefcfb3c11d6d2e71be076a5d3df2e88ab73ed",
    "tree": "3e815d4d338aa1a201e009b36cf34e5a53ad4c9e",
    "submodules": []
  },
  "local_only": true,
  "publication": "disabled",
  "content_sha256": "038652c31fa459cf95247274ade47692dab5dd4a49471d909421cab86d308e6e"
}
